Text;Tokenization;Normalization;Stop_Removal;Tweet_Stemmed;sentimen
karena hoya keluar infinite jadinya nge inpi mereda tapi masih nikmatin musik kpop cuma kayaknya dr gen terlalu buanyak banget berjamur malah jadi bosen sendiri;[karena, hoya, keluar, infinite, jadinya, nge, inpi, mereda, tapi, masih, nikmatin, musik, kpop, cuma, kayaknya, dr, gen, terlalu, buanyak, banget, berjamur, malah, jadi, bosen, sendiri];[karena, hoya, keluar, infinite, jadinya, nge, inpi, mereda, tapi, masih, menikmati, musik, kpop, cuma, kayaknya, dari, gen, terlalu, buanyak, banget, berjamur, malah, jadi, bosan, sendiri];[hoya, infinite, nge, inpi, mereda, tapi, menikmati, musik, kpop, kayaknya, gen, terlalu, buanyak, banget, berjamur, bosan];[hoya, infinite, nge, inpi, reda, tapi, nikmat, musik, kpop, kayak, gen, terlalu, banyak, banget, jamur, bosan];negatif
gua gapernah seasdfgghkllaks ini sama idol kpop tapi sekarang sialan lu seventeen gue jadi gila;[gua, gapernah, seasdfgghkllaks, ini, sama, idol, kpop, tapi, sekarang, sialan, lu, seventeen, gue, jadi, gila];[gue, enggak pernah, seasdfgghkllaks, ini, sama, idol, kpop, tapi, sekarang, sialan, lu, seventeen, gue, jadi, gila];[gue, enggak pernah, idol, kpop, sialan, lu, seventeen, gue, gila];[gue, enggak pernah, idol, kpop, sial, lu, seventeen, gue, gila];negatif
nge ss in sw orang yg kesindir gr video gw ngomongin wibu ma kpopbtw ni swmenit setelah gw nge sw in tuh vid;[nge, ss, in, sw, orang, yg, kesindir, gr, video, gw, ngomongin, wibu, ma, kpopbtw, ni, swmenit, setelah, gw, nge, sw, in, tuh, vid];[nge, ss, ini, sw, orang, yang, kesindir, gr, video, gue, mengomongkan, wibu, sama, kpopbtw, ini, swmenit, setelah, gue, nge, sw, ini, tuh, vid];[nge, ss, sw, orang, kesindir, gr, video, gue, mengomongkan, wibu, kpopbtw, swmenit, gue, nge, sw, tuh, vid];[nge, ss, sw, orang, sindir, gr, video, gue, omong, wibu, kpopbtw, swmenit, gue, nge, sw, tuh, vid];negatif
lu kenapa nulis nine percent pakek huruf hangul heyntar dikiranya grup kpop lg;[lu, kenapa, nulis, nine, percent, pakek, huruf, hangul, heyntar, dikiranya, grup, kpop, lg];[lu, kenapa, menulis, nine, percent, pakai, huruf, hangul, heyntar, dikiranya, grup, kpop, lagi];[lu, menulis, nine, percent, pakai, huruf, hangul, hey, dikiranya, grup, kpop];[lu, tulis, nine, percent, pakai, huruf, hangul, hey, kira, grup, kpop];negatif
karena kalian juga bisa liat retweet an aku juga bukan cuman tentang kpop tentang badminton berita ataupun perasaan yang lagi dirasa aja yaa;[karena, kalian, juga, bisa, liat, retweet, an, aku, juga, bukan, cuman, tentang, kpop, tentang, badminton, berita, ataupun, perasaan, yang, lagi, dirasa, aja, yaa];[karena, kalian, juga, bisa, lihat, retweet, an, aku, juga, bukan, cuman, tentang, kpop, tentang, badminton, berita, ataupun, perasaan, yang, lagi, dirasa, saja, iya];[lihat, retweet, an, cuman, kpop, badminton, berita, perasaan, dirasa, iya];[lihat, retweet, an, cuman, kpop, badminton, berita, rasa, rasa, iya];netral
terimakasih ke kita karena udah cinta sama kpop padahal ak cinta group kamu doang anjir;[terimakasih, ke, kita, karena, udah, cinta, sama, kpop, padahal, ak, cinta, group, kamu, doang, anjir];[terimakasih, ke, kita, karena, sudah, cinta, sama, kpop, padahal, aku, cinta, group, kamu, doang, anjir];[terimakasih, cinta, kpop, cinta, group, doang, anjir];[terimakasih, cinta, kpop, cinta, group, doang, anjir];positif
aku di goodieskpop ig kak dulu beli album xiumin disitu;[aku, di, goodieskpop, ig, kak, dulu, beli, album, xiumin, disitu];[aku, di, goodieskpop, ig, kak, dulu, beli, album, xiumin, disitu];[goodieskpop, ig, kak, beli, album, xiumin, disitu];[goodieskpop, ig, kak, beli, album, xiumin, situ];netral
semoga saja sejauh ini kenal kpop cuman kali ini yang paling jauh nyupportnya dulu ga se hype ini;[semoga, saja, sejauh, ini, kenal, kpop, cuman, kali, ini, yang, paling, jauh, nyupportnya, dulu, ga, se, hype, ini];[semoga, saja, sejauh, ini, kenal, kpop, cuman, kali, ini, yang, paling, jauh, nyupportnya, dulu, enggak, se, hype, ini];[semoga, kenal, kpop, cuman, kali, nyupportnya, hype];[moga, kenal, kpop, cuman, kali, support, hype];positif
nah klo konteksnya masalah tgl yg beda sehari sama hari merdeka korea gpp deh yg tdi itu nyalahin knp kpop kayak hilang rootnya n makin global aneh bgt lu op kan pemerintah lu sendiri yg jadiin kpop produk ekspor ckck;[nah, klo, konteksnya, masalah, tgl, yg, beda, sehari, sama, hari, merdeka, korea, gpp, deh, yg, tdi, itu, nyalahin, knp, kpop, kayak, hilang, rootnya, n, makin, global, aneh, bgt, lu, op, kan, pemerintah, lu, sendiri, yg, jadiin, kpop, produk, ekspor, ckck];[nah, kalo, konteksnya, masalah, tanggal, yang, beda, sehari, sama, hari, merdeka, korea, enggak apa-apa, deh, yang, tadi, itu, menyalahkan, kenapa, kpop, kayak, hilang, rootnya, n, makin, global, aneh, banget, lu, op, kan, pemerintah, lu, sendiri, yang, jadikan, kpop, produk, ekspor, ckck];[kalo, konteksnya, tanggal, beda, sehari, merdeka, korea, enggak apa-apa, deh, menyalahkan, kpop, kayak, hilang, rootnya, n, global, aneh, banget, lu, op, pemerintah, lu, jadikan, kpop, produk, ekspor, ckck];[kalo, konteks, tanggal, beda, hari, merdeka, korea, enggak apa, deh, salah, kpop, kayak, hilang, rootnya, n, global, aneh, banget, lu, op, perintah, lu, jadi, kpop, produk, ekspor, ckck];negatif
ini si bukan tp soalnya bener first time war tiket konser kpop and i got it bahkan screen record yg gajelas aja masih disimpen pas war ini;[ini, si, bukan, tp, soalnya, bener, first, time, war, tiket, konser, kpop, and, i, got, it, bahkan, screen, record, yg, gajelas, aja, masih, disimpen, pas, war, ini];[ini, sih, bukan, tapi, soalnya, benar, first, time, war, tiket, konser, kpop, and, i, got, itu, bahkan, screen, record, yang, enggak jelas, saja, masih, disimpen, pas, war, ini];[sih, bukan, tapi, soalnya, first, time, war, tiket, konser, kpop, and, i, got, screen, record, enggak jelas, disimpen, pas, war];[sih, bukan, tapi, soalnya, first, time, war, tiket, konser, kpop, and, i, got, screen, record, enggak jelas, disimpen, pas, war];negatif
biggest patah hati kpop ku sejujurnya;[biggest, patah, hati, kpop, ku, sejujurnya];[biggest, patah, hati, kpop, ku, sejujurnya];[biggest, patah, hati, kpop, ku, sejujurnya];[biggest, patah, hati, kpop, ku, jujur];negatif
gue ngerti kpop ngerti make up ngerti buku ngerti masakan mgerti fashion kek gue cewek banget and i love being a women;[gue, ngerti, kpop, ngerti, make, up, ngerti, buku, ngerti, masakan, mgerti, fashion, kek, gue, cewek, banget, and, i, love, being, a, women];[gue, mengerti, kpop, mengerti, memakai, up, mengerti, buku, mengerti, masakan, mengerti, fashion, kayak, gue, cewek, banget, and, i, love, being, a, women];[gue, mengerti, kpop, mengerti, memakai, up, mengerti, buku, mengerti, masakan, mengerti, fashion, kayak, gue, cewek, banget, and, i, love, being, a, women];[gue, ngerti, kpop, ngerti, pakai, up, ngerti, buku, ngerti, masakan, mgerti, fashion, kayak, gue, cewek, banget, and, i, love, being, a, women];positif
cuma sekali itu doang itu jg tbtb putus sama gyuvin karena dia ngeliat aku beli pc cowo kpop lain;[cuma, sekali, itu, doang, itu, jg, tbtb, putus, sama, gyuvin, karena, dia, ngeliat, aku, beli, pc, cowo, kpop, lain];[cuma, sekali, itu, doang, itu, juga, tbtb, putus, sama, gyuvin, karena, dia, melihat, aku, beli, pc, cowok, kpop, lain];[doang, tbtb, putus, gyuvin, beli, pc, cowok, kpop];[doang, tbtb, putus, gyuvin, beli, pc, cowok, kpop];negatif
ayo ayo sini sama aidan available di tanggal nih pecinta love hate dan suka banget jahilin ngejekin pacarnya selera musik ku beragam si nder gak muluk itu itu terus suka ganti ganti kadang jj angkot dangdut mellow kpop dan masih ban;[ayo, ayo, sini, sama, aidan, available, di, tanggal, nih, pecinta, love, hate, dan, suka, banget, jahilin, ngejekin, pacarnya, selera, musik, ku, beragam, si, nder, gak, muluk, itu, itu, terus, suka, ganti, ganti, kadang, jj, angkot, dangdut, mellow, kpop, dan, masih, ban];[ayo, ayo, sini, sama, aidan, available, di, tanggal, nih, pecinta, love, hate, dan, suka, banget, jahilin, ngejekin, pacarnya, selera, musik, ku, beragam, sih, nder, enggak, muluk, itu, itu, terus, suka, ganti, ganti, kadang, jj, angkot, dangdut, mellow, kpop, dan, masih, ban];[ayo, ayo, aidan, available, tanggal, nih, pecinta, love, hate, suka, banget, jahilin, ngejekin, pacarnya, selera, musik, ku, beragam, sih, nder, muluk, suka, ganti, ganti, kadang, jj, angkot, dangdut, mellow, kpop, ban];[ayo, ayo, aidan, available, tanggal, nih, cinta, love, hate, suka, banget, jahilin, ngejekin, pacar, selera, musik, ku, agam, sih, nder, muluk, suka, ganti, ganti, kadang, jj, angkot, dangdut, mellow, kpop, ban];positif
semua idol kpop nderr krna ada peraturan dri china nya juga kan;[semua, idol, kpop, nderr, krna, ada, peraturan, dri, china, nya, juga, kan];[semua, idol, kpop, nderr, karena, ada, peraturan, dari, china, nya, juga, kan];[idol, kpop, nderr, peraturan, china, nya];[idol, kpop, nderr, atur, china, nya];netral
dirumah aja rebahan makan jalan jalan nonton konser kpop;[dirumah, aja, rebahan, makan, jalan, jalan, nonton, konser, kpop];[dirumah, saja, rebahan, makan, jalan, jalan, menonton, konser, kpop];[dirumah, rebahan, makan, jalan, jalan, menonton, konser, kpop];[rumah, rebah, makan, jalan, jalan, tonton, konser, kpop];positif
najis ih ska kpop sampe bikin lu bs ngomong kek gt;[najis, ih, ska, kpop, sampe, bikin, lu, bs, ngomong, kek, gt];[najis, ih, suka, kpop, sampai, bikin, lu, bisa, mengomong, seperti, begitu];[najis, ih, suka, kpop, bikin, lu, mengomong, seperti];[najis, ih, suka, kpop, bikin, lu, omong, seperti];negatif
pernah tapi itu udah lama banget sejak hubungan korea ama china ga baik grup kpop ga konser lagi ke china;[pernah, tapi, itu, udah, lama, banget, sejak, hubungan, korea, ama, china, ga, baik, grup, kpop, ga, konser, lagi, ke, china];[pernah, tapi, itu, sudah, lama, banget, sejak, hubungan, korea, sama, china, enggak, baik, grup, kpop, enggak, konser, lagi, ke, china];[banget, hubungan, korea, china, grup, kpop, konser, china];[banget, hubung, korea, china, grup, kpop, konser, china];negatif
buseeeeet canggih bener u bikin gebrakan kpop industry;[buseeeeet, canggih, bener, u, bikin, gebrakan, kpop, industry];[buset, canggih, benar, untuk, bikin, gebrakan, kpop, industry];[buset, canggih, bikin, gebrakan, kpop, industry];[buset, canggih, bikin, gebrak, kpop, industry];positif
semua idol kpop kayanya kecuali yg emang orang chinanya nder karena dulu ada aturan dari pemerintah idol kpop gak boleh tampil disana;[semua, idol, kpop, kayanya, kecuali, yg, emang, orang, chinanya, nder, karena, dulu, ada, aturan, dari, pemerintah, idol, kpop, gak, boleh, tampil, disana];[semua, idol, kpop, kayanya, kecuali, yang, memang, orang, chinanya, nder, karena, dulu, ada, aturan, dari, pemerintah, idol, kpop, enggak, boleh, tampil, disana];[idol, kpop, kayanya, kecuali, orang, chinanya, nder, aturan, pemerintah, idol, kpop, tampil, disana];[idol, kpop, kaya, kecuali, orang, chinanya, nder, atur, perintah, idol, kpop, tampil, sana];negatif
aahh iya mungkin ra ak juga agak lupa wkwk;[aahh, iya, mungkin, ra, ak, juga, agak, lupa, wkwk];[ah, iya, mungkin, ra, aku, juga, agak, lupa, wkwk];[ah, iya, ra, lupa];[ah, iya, ra, lupa];netral
liat cwk kpop hobi ku wkwk;[liat, cwk, kpop, hobi, ku, wkwk];[lihat, cwk, kpop, hobi, ku, wkwk];[lihat, cwk, kpop, hobi, ku];[lihat, cwk, kpop, hobi, ku];positif
kalo dibilang suka ya masi suka si tp ga se aktif dl karna bias aku pada wamil boy group fav aku disband hiatus sampe akhirnya cape mau ngikutin grup baru trus fokus belajar sama sibuk ngurusin masuk ptn dan ya skrg udh mau smtdan aku;[kalo, dibilang, suka, ya, masi, suka, si, tp, ga, se, aktif, dl, karna, bias, aku, pada, wamil, boy, group, fav, aku, disband, hiatus, sampe, akhirnya, cape, mau, ngikutin, grup, baru, trus, fokus, belajar, sama, sibuk, ngurusin, masuk, ptn, dan, ya, skrg, udh, mau, smtdan, aku];[kalo, dibilang, suka, ya, masih, suka, sih, tapi, enggak, se, aktif, dulu, karena, bias, aku, pada, wamil, boy, group, favorit, aku, disband, hiatus, sampai, akhirnya, capek, mau, mengikuti, grup, baru, terus, fokus, belajar, sama, sibuk, mengurusi, masuk, ptn, dan, ya, sekarang, sudah, mau, smtdan, aku];[kalo, dibilang, suka, ya, suka, sih, aktif, bias, wamil, boy, group, favorit, disband, hiatus, capek, mengikuti, grup, fokus, belajar, sibuk, mengurusi, masuk, ptn, ya, smtdan];[kalo, bilang, suka, ya, suka, sih, aktif, bias, wamil, boy, group, favorit, disband, hiatus, capek, ikut, grup, fokus, ajar, sibuk, urus, masuk, ptn, ya, smtdan];positif
sedikit tips dari gua lebih woh the price ke singapore daripada lu beli di calo di jakaa deh asliiii gu;[sedikit, tips, dari, gua, lebih, woh, the, price, ke, singapore, daripada, lu, beli, di, calo, di, jakaa, deh, asliiii, gu];[sedikit, tips, dari, gue, lebih, woh, the, price, ke, singapore, daripada, lu, beli, di, calo, di, jakaa, deh, asli, gu];[tips, gue, woh, the, price, singapore, lu, beli, calo, jakaa, deh, asli, gu];[tips, gue, woh, the, price, singapore, lu, beli, calo, jakaa, deh, asli, gu];netral
wkwk pke dn cowo kpop boleh ga;[wkwk, pke, dn, cowo, kpop, boleh, ga];[wkwk, pakai, dan, cowok, kpop, boleh, enggak];[pakai, cowok, kpop];[pakai, cowok, kpop];netral
the urge to exchange numbers with my fellow myzeroses but status whatsapp kita x mcm twitter dia mcm jadi org lain sbb kat twt and close fren je meroyan pasal kpop kalau tak selalu post pasal aktivitiprogram uni semua;[the, urge, to, exchange, numbers, with, my, fellow, myzeroses, but, status, whatsapp, kita, x, mcm, twitter, dia, mcm, jadi, org, lain, sbb, kat, twt, and, close, fren, je, meroyan, pasal, kpop, kalau, tak, selalu, post, pasal, aktivitiprogram, uni, semua];[the, urge, tapi, exchange, numbers, with, my, fellow, myzeroses, but, status, whatsapp, kita, kali, macam, twitter, dia, macam, jadi, orang, lain, sebab, kat, twt, and, close, fren, je, meroyan, pasal, kpop, kalau, tak, selalu, post, pasal, aktivitiprogram, uni, semua];[the, urge, exchange, numbers, with, my, fellow, myzeroses, but, status, whatsapp, kali, twitter, orang, kat, twt, and, close, fren, je, meroyan, pasal, kpop, post, pasal, aktivitiprogram, uni];[the, urge, exchange, numbers, with, my, fellow, myzeroses, but, status, whatsapp, kali, twitter, orang, kat, twt, and, close, fren, je, royan, pasal, kpop, post, pasal, aktivitiprogram, uni];negatif
akun gue isinya kpop anjir jangan difollow;[akun, gue, isinya, kpop, anjir, jangan, difollow];[akun, gue, isinya, kpop, anjir, jangan, difollow];[akun, gue, isinya, kpop, anjir, difollow];[akun, gue, isi, kpop, anjir, follow];negatif
lbih baik kpop an lagu tahun itu adlh prime era kpop;[lbih, baik, kpop, an, lagu, tahun, itu, adlh, prime, era, kpop];[lebih, baik, kpop, an, lagu, tahun, itu, adalah, prime, era, kpop];[kpop, an, lagu, tahun, itu, prime, era, kpop];[kpop, an, lagu, tahun, itu, prime, era, kpop];positif
malam teume yang masih mencari teulight dengan harga terjangkau dan tentunya original bisa klik link dibawah ini ya;[malam, teume, yang, masih, mencari, teulight, dengan, harga, terjangkau, dan, tentunya, original, bisa, klik, link, dibawah, ini, ya];[malam, teume, yang, masih, mencari, teulight, dengan, harga, terjangkau, dan, tentunya, original, bisa, klik, link, dibawah, ini, iya];[malam, teume, mencari, teulight, harga, terjangkau, original, klik, link, dibawah, iya];[malam, teume, cari, teulight, harga, jangkau, original, klik, link, bawah, iya];netral
dance kpop tersusah buat gw jatuh pada illella mamamoo afakah ak hrs berguru kepada keempat pelawakku;[dance, kpop, tersusah, buat, gw, jatuh, pada, illella, mamamoo, afakah, ak, hrs, berguru, kepada, keempat, pelawakku];[dance, kpop, tersusah, buat, gue, jatuh, pada, illella, mamamoo, apakah, aku, harus, berguru, kepada, keempat, pelawakku];[dance, kpop, tersusah, gue, jatuh, illella, mamamoo, berguru, keempat, pelawakku];[dance, kpop, susah, gue, jatuh, illella, mamamoo, guru, empat, pelawak];negatif
sama aja kaya kpop stan yg suka sok senior;[sama, aja, kaya, kpop, stan, yg, suka, sok, senior];[sama, saja, kayak, kpop, stan, yang, suka, sok, senior];[kayak, kpop, stan, suka, sok, senior];[kayak, kpop, stan, suka, sok, senior];negatif
aku niatnya war sendiri tapi i have experience on ticketing apalagi kpop conce aku baru pertama kali mau nonton jadi nul putul kalo jastip sayang duitnya mending buat transport hotel sedih mana aku gabener punya banyak temen;[aku, niatnya, war, sendiri, tapi, i, have, experience, on, ticketing, apalagi, kpop, conce, aku, baru, pertama, kali, mau, nonton, jadi, nul, putul, kalo, jastip, sayang, duitnya, mending, buat, transport, hotel, sedih, mana, aku, gabener, punya, banyak, temen];[aku, niatnya, war, sendiri, tapi, i, have, experience, on, ticketing, apalagi, kpop, conce, aku, baru, pertama, kali, mau, menonton, jadi, nul, putul, kalo, jastip, sayang, duitnya, mending, buat, transport, hotel, sedih, mana, aku, gabener, punya, banyak, teman];[niatnya, war, i, have, experience, on, ticketing, kpop, conce, pertama, kali, menonton, kalo, jastip, sayang, duitnya, mending, transport, hotel, sedih, gabener, teman];[niat, war, i, have, experience, on, ticketing, kpop, conce, pertama, kali, tonton, kalo, jastip, sayang, duit, mending, transport, hotel, sedih, gabener, teman];negatif
kangen cowo kpop gw hhhhh;[kangen, cowo, kpop, gw, hhhhh];[kangen, cowok, kpop, gue, hhhhh];[kangen, cowok, kpop, gue];[kangen, cowok, kpop, gue];positif
hooh prnh di kcon ingat aku mknya kukira kpop bg;[hooh, prnh, di, kcon, ingat, aku, mknya, kukira, kpop, bg];[hooh, pernah, di, kcon, ingat, aku, makanya, kukira, kpop, bang];[hooh, kcon, kukira, kpop, bang];[hooh, kcon, kira, kpop, bang];netral
iya aku aja yg dah ketuaan buat fan kpop;[iya, aku, aja, yg, dah, ketuaan, buat, fan, kpop];[iya, aku, saja, yang, deh, ketuaan, buat, fan, kpop];[iya, deh, ketuaan, fan, kpop];[iya, deh, tua, fan, kpop];negatif
sabar ya kaaaaak aku selesaiin satu satu perbucinan cowok kpop ini;[sabar, ya, kaaaaak, aku, selesaiin, satu, satu, perbucinan, cowok, kpop, ini];[sabar, iya, kak, aku, selesaiin, satu, satu, perbucinan, cowok, kpop, ini];[sabar, iya, kak, selesaiin, perbucinan, cowok, kpop];[sabar, iya, kak, selesai, bucin, cowok, kpop];positif
ni kalo idol kpop nenangin fansnya yg huruhara pake gayung ijo apa ga dirujak kntz;[ni, kalo, idol, kpop, nenangin, fansnya, yg, huruhara, pake, gayung, ijo, apa, ga, dirujak, kntz];[ini, kalo, idol, kpop, nenangin, fansnya, yang, huruhara, pakai, gayung, ijo, apa, enggak, dirujak, kntz];[kalo, idol, kpop, nenangin, fansnya, huruhara, pakai, gayung, ijo, dirujak, kntz];[kalo, idol, kpop, nenangin, fans, huruhara, pakai, gayung, ijo, rujak, kntz];negatif
sbt coba boleh tunjukin desk atau rak kpop mu tida sender soalnya baru pindahan dan mau deco ulang tapi bingung mau design kyk gmn;[sbt, coba, boleh, tunjukin, desk, atau, rak, kpop, mu, tida, sender, soalnya, baru, pindahan, dan, mau, deco, ulang, tapi, bingung, mau, design, kyk, gmn];[sbt, coba, boleh, tunjukkan, desk, atau, rak, kpop, mu, tida, sender, soalnya, baru, pindahan, dan, mau, deco, ulang, tapi, bingung, mau, design, kayak, bagaimana];[sbt, coba, tunjukkan, desk, rak, kpop, mu, tida, sender, pindahan, deco, ulang, bingung, design, kayak];[sbt, coba, tunjuk, desk, rak, kpop, mu, tida, sender, pindah, deco, ulang, bingung, design, kayak];netral
di bandung ada toko kpopkstore yg jual kolbuk gitu gak ya;[di, bandung, ada, toko, kpopkstore, yg, jual, kolbuk, gitu, gak, ya];[di, bandung, ada, toko, kpopkstore, yang, jual, kolbuk, begitu, enggak, ya];[bandung, toko, kpopkstore, jual, kolbuk, ya];[bandung, toko, kpopkstore, jual, kolbuk, ya];netral
kriteria pacar idaman jungwoo nct apakah kamu orangnya;[kriteria, pacar, idaman, jungwoo, nct, apakah, kamu, orangnya];[kriteria, pacar, idaman, jungwoo, nct, apakah, kamu, orangnya];[kriteria, pacar, idaman, jungwoo, nct, orangnya];[kriteria, pacar, idam, jungwoo, nct, orang];positif
lagu kpop nd gen terbaik jatuh kepada;[lagu, kpop, nd, gen, terbaik, jatuh, kepada];[lagu, kpop, nd, gen, terbaik, jatuh, kepada];[lagu, kpop, gen, terbaik, jatuh];[lagu, kpop, gen, baik, jatuh];positif
guys konten kpop yang kalo di tonton itu bikin kita ngakak brutal sampe ngik ngok ngik ngok aph yhmw cri pengalihan;[guys, konten, kpop, yang, kalo, di, tonton, itu, bikin, kita, ngakak, brutal, sampe, ngik, ngok, ngik, ngok, aph, yhmw, cri, pengalihan];[teman, konten, kpop, yang, kalo, di, tonton, itu, bikin, kita, ketawa, brutal, sampai, ngik, ngok, ngik, ngok, apa, iya, mau, cari, pengalihan];[teman, konten, kpop, kalo, tonton, bikin, ketawa, brutal, iya, mau, cari, pengalihan];[teman, konten, kpop, kalo, tonton, bikin, ketawa, brutal, iya, mau, cari, alih];positif
mjb banyak kok yg aman dan terpercaya bisa ke evtallprojects dreamingforyou kpopsale;[mjb, banyak, kok, yg, aman, dan, terpercaya, bisa, ke, evtallprojects, dreamingforyou, kpopsale];[mjb, banyak, kok, yang, aman, dan, terpercaya, bisa, ke, evtallprojects, dreamingforyou, kpopsale];[mjb, aman, terpercaya, evtallprojects, dreamingforyou, kpopsale];[mjb, aman, percaya, evtallprojects, dreamingforyou, kpopsale];netral
mau open po merch hype inshight ada yang mau kahhh tp limited slot guys kl mau langsung dm ya;[mau, open, po, merch, hype, inshight, ada, yang, mau, kahhh, tp, limited, slot, guys, kl, mau, langsung, dm, ya];[mau, open, po, merch, hype, inshight, ada, yang, mau, kahhh, tapi, limited, slot, guys, kalau, mau, langsung, dm, ya];[open, po, merch, hype, inshight, kahhh, limited, slot, guys, langsung, dm, ya];[open, po, merch, hype, inshight, kahhh, limited, slot, guys, langsung, dm, iya];netral
tapi kita juga harus sadar karna adanya orang ina di grup itu pastinya banyak orang awam yang masuk dunia kpop apa lagi dia dulu pernah menjadi influence di indonesia;[tapi, kita, juga, harus, sadar, karna, adanya, orang, ina, di, grup, itu, pastinya, banyak, orang, awam, yang, masuk, dunia, kpop, apa, lagi, dia, dulu, pernah, menjadi, influence, di, indonesia];[tapi, kita, juga, harus, sadar, karena, adanya, orang, ina, di, grup, itu, pastinya, banyak, orang, awam, yang, masuk, dunia, kpop, apa, lagi, dia, dulu, pernah, menjadi, influence, di, indonesia];[sadar, orang, ina, grup, pastinya, orang, awam, masuk, dunia, kpop, influence, indonesia];[sadar, orang, ina, grup, pasti, orang, awam, masuk, dunia, kpop, influence, indonesia];positif
cowok kpop dan cowok ai;[cowok, kpop, dan, cowok, ai];[cowok, kpop, dan, cowok, ai];[cowok, kpop, cowok, ai];[cowok, kpop, cowok, ai];netral
aslii sekarang akuuu palingg sering ngehype kpop di toktok;[aslii, sekarang, akuuu, palingg, sering, ngehype, kpop, di, toktok];[aslii, sekarang, aku, palingg, sering, ngehype, kpop, di, toktok];[aslii, palingg, ngehype, kpop, toktok];[asli, paling, hype, kpop, toktok];positif
kak coba dong kamu buat au non kpop kayanya bagus deee — mau baca emang kalo aku buat orific gitu visualnya western hahaa;[kak, coba, dong, kamu, buat, au, non, kpop, kayanya, bagus, deee, mau, baca, emang, kalo, aku, buat, orific, gitu, visualnya, western, hahaa];[kak, coba, dong, kamu, buat, au, non, kpop, kayanya, bagus, deee, mau, baca, memang, kalo, aku, buat, orific, begitu, visualnya, western, hahaa];[kak, coba, au, non, kpop, kayanya, bagus, deee, baca, kalo, orific, visualnya, western];[kak, coba, au, non, kpop, kaya, bagus, deee, baca, kalo, orific, visual, western];positif
mjb banyak kok yg aman dan terpercaya bisa ke evtallprojects dreamingforyou kpopsale allaboutmerchkpop atau aceallprojects ini semua di instagram;[mjb, banyak, kok, yg, aman, dan, terpercaya, bisa, ke, evtallprojects, dreamingforyou, kpopsale, allaboutmerchkpop, atau, aceallprojects, ini, semua, di, instagram];[mjb, banyak, kok, yang, aman, dan, terpercaya, bisa, ke, evtallprojects, dreamingforyou, kpopsale, allaboutmerchkpop, atau, aceallprojects, ini, semua, di, instagram];[aman, terpercaya, evtallprojects, dreamingforyou, kpopsale, allaboutmerchkpop, aceallprojects, instagram];[aman, percaya, evtallprojects, dreamingforyou, kpopsale, allaboutmerchkpop, aceallprojects, instagram];netral
pengen banget jadi fans kpop yang positif tapi idola gw jenne sam taehyun ya susah;[pengen, banget, jadi, fans, kpop, yang, positif, tapi, idola, gw, jenne, sam, taehyun, ya, susah];[ingin, banget, jadi, fan, kpop, yang, positif, tapi, idola, gue, jenne, sama, taehyun, iya, susah];[ingin, banget, fan, kpop, positif, idola, gue, jenne, taehyun, iya, susah];[ingin, banget, fan, kpop, positif, idola, gue, jenne, taehyun, iya, susah];positif
temen deket gue yg tau perjalanan fangirl gue keknya cuma ayasss doang mulai dari kpop luyoon hard shipper nyampe jadi brightwin hard shipper;[temen, deket, gue, yg, tau, perjalanan, fangirt, gue, keknya, cuma, ayasss, doang, mulai, dari, kpop, luyoon, hard, shipper, nyampe, jadi, brightwin, hard, shipper];[teman, dekat, gue, yang, tau, perjalanan, fangirt, gue, kayaknya, cuma, ayasss, doang, mulai, dari, kpop, luyoon, hard, shipper, sampai, jadi, brightwin, hard, shipper];[teman, gue, tau, perjalanan, fangirt, gue, kayaknya, ayasss, doang, kpop, luyoon, hard, shipper, brightwin, hard, shipper];[teman, gue, tau, jalan, fangirl, gue, kayak, ayasss, doang, kpop, luyoon, hard, shipper, brightwin, hard, shipper];positif
cowo kpop pentingnya udah setara sama panadol gua;[cowo, kpop, pentingnya, udah, setara, sama, panadol, gua];[cowok, kpop, pentingnya, sudah, seimbang, sama, panadol, gue];[cowok, kpop, seimbang, panadol, gue];[cowok, kpop, imbang, panadol, gue];positif
baru tauu ini wkwkwk kukira mrk kpop grup;[baru, tauu, ini, wkwkwk, kukira, mrk, kpop, grup];[baru, tau, ini, wkwkwk, kukira, mereka, kpop, grup];[tau, kukira, kpop, grup];[tau, kira, kpop, grup];netral
