Text;Tokenization;Normalization;Stop_Removal;Tweet_Stemmed;sentimen
ada du yg suka kpop jg tp w blm siap memulai percakapan itu;[ada, du, yg, suka, kpop, jg, tp, w, blm, siap, memulai, percakapan, itu];[ada, du, yang, suka, kpop, juga, tapi, gue, belum, siap, memulai, percakapan, itu];[du, suka, kpop, gue, percakapan];[du, suka, kpop, gue, cakap];positif
anjay kasian bet mereka ngurusin cocoknya formasi sebuah grup kpop kayak gimana lu semua lee sooman kah;[anjay, kasian, bet, mereka, ngurusin, cocoknya, formasi, sebuah, grup, kpop, kayak, gimana, lu, semua, lee, sooman, kah];[anjay, kasihan, banget, mereka, mengurusi, cocoknya, formasi, sebuah, grup, kpop, kayak, bagaimana, lu, semua, lee, sooman, kah];[anjay, kasihan, banget, mengurusi, cocoknya, formasi, grup, kpop, kayak, lu, lee, sooman, kah];[anjay, kasihan, banget, urus, cocok, formasi, grup, kpop, kayak, lu, lee, sooman, kah];negatif
ls kpop gk penting;[ls, kpop, gk, penting];[ls, kpop, enggak, penting];[ls, kpop];[ls, kpop];negatif
idol apa yang bikin kalian nangis sekali sampe galau berhari dalam dunia kpop;[idol, apa, yang, bikin, kalian, nangis, sekali, sampe, galau, berhari, dalam, dunia, kpop];[idol, apa, yang, bikin, kalian, menangis, sekali, sampai, galau, berhari, dalam, dunia, kpop];[idol, bikin, menangis, galau, berhari, dunia, kpop];[idol, bikin, menang, galau, hari, dunia, kpop];negatif
eh ga tau deng harga pasaran konser kpop rata rata segitu apa nggak maaf w ga pernah nonton konser;[eh, ga, tau, deng, harga, pasaran, konser, kpop, rata, rata, segitu, apa, nggak, maaf, w, ga, pernah, nonton, konser];[eh, enggak, tau, deng, harga, pasaran, konser, kpop, rata, rata, segitu, apa, enggak, maaf, gue, enggak, pernah, menonton, konser];[eh, tau, deng, harga, pasaran, konser, kpop, segitu, maaf, gue, menonton, konser];[eh, tau, deng, harga, pasar, konser, kpop, segitu, maaf, gue, tonton, konser];netral
udah dengerin berasa balik ke kpop jaman gendah seruuuu;[udah, dengerin, berasa, balik, ke, kpop, jaman, gendah, seruuuu];[sudah, dengarkan, berasa, balik, ke, kpop, jaman, gendah, seruuuu];[dengarkan, berasa, kpop, jaman, gendah, seruuuu];[dengar, asa, kpop, jaman, gendah, seruuuu];positif
pernahhhhhh wkwkw ninggalin kpop karna sibuk banget sama real life kerjaan dan saat itu lagi masa masanya galau sinting gtu tapi sekarang balik kpop an lagi soalnya bosen lagi engg kerja;[pernahhhhhh, wkwkw, ninggalin, kpop, karna, sibuk, banget, sama, real, life, kerjaan, dan, saat, itu, lagi, masa, masanya, galau, sinting, gtu, tapi, sekarang, balik, kpop, an, lagi, soalnya, bosen, lagi, engg, kerja];[pernahhhhhh, wkwkw, meninggalkan, kpop, karena, sibuk, banget, sama, real, life, pekerjaan, dan, saat, itu, lagi, masa, masanya, galau, sinting, begitu, tapi, sekarang, balik, kpop, an, lagi, soalnya, bosan, lagi, engg, kerja];[pernahhhhhh, wkwkw, meninggalkan, kpop, sibuk, banget, real, life, pekerjaan, masanya, galau, sinting, kpop, an, bosan, engg, kerja];[pernahhhhhh, wkwkw, tinggal, kpop, sibuk, banget, real, life, kerja, masa, galau, sinting, kpop, an, bosan, engg, kerja];positif
dulu temen sebangku ada yang kpopers banget dan dia juga main rp supaya bisa ngobrol sama dia akhirnya aku juga masuk ke dunia rp dan dari situ mulai jadi kpoperssampe isi galeri isinya perkpop an trus pisah pas sma dari situ sampe se;[dulu, temen, sebangku, ada, yang, kpopers, banget, dan, dia, juga, main, rp, supaya, bisa, ngobrol, sama, dia, akhirnya, aku, juga, masuk, ke, dunia, rp, dan, dari, situ, mulai, jadi, kpoperssampe, isi, galeri, isinya, perkpop, an, trus, pisah, pas, sma, dari, situ, sampe, se];[dulu, teman, sebangku, ada, yang, kpopers, banget, dan, dia, juga, main, rp, supaya, bisa, mengobrol, sama, dia, akhirnya, aku, juga, masuk, ke, dunia, rp, dan, dari, situ, mulai, jadi, kpoperssampe, isi, galeri, isinya, perkpop, an, terus, pisah, pas, sama, dari, situ, sampai, se];[teman, sebangku, kpopers, banget, main, rp, mengobrol, masuk, dunia, rp, situ, kpoperssampe, isi, galeri, isinya, perkpop, an, pisah, pas, situ];[teman, bang, kpopers, banget, main, rp, obrol, masuk, dunia, rp, situ, kpoperssampe, isi, galeri, isi, perkpop, an, pisah, pas, situ];positif
yg kaya gini berlaku buat semua ga si banyak kreator reaction yg milih video yg direact buat nambah views contoh video yg bakal banyak views react lagu kpop anisong any indo related trending video etc;[yg, kaya, gini, berlaku, buat, semua, ga, si, banyak, kreator, reaction, yg, milih, video, yg, direact, buat, nambah, views, contoh, video, yg, bakal, banyak, views, react, lagu, kpop, anisong, any, indo, related, trending, video, etc];[yang, kayak, begini, berlaku, buat, semua, enggak, sih, banyak, kreator, reaction, yang, memilih, video, yang, direact, buat, bertambah, views, contoh, video, yang, bakal, banyak, views, react, lagu, kpop, anisong, any, indonesia, related, trending, video, etc];[kayak, berlaku, sih, kreator, reaction, memilih, video, direact, bertambah, views, contoh, video, views, react, lagu, kpop, anisong, any, indonesia, related, trending, video, etc];[kayak, laku, sih, kreator, reaction, pilih, video, direact, tambah, views, contoh, video, views, react, lagu, kpop, anisong, any, indonesia, related, trending, video, etc];positif
kalo beneran bts gini pasti para artis kpop lain pada niru eakk;[kalo, beneran, bts, gini, pasti, para, artis, kpop, lain, pada, niru, eakk];[kalo, benaran, bts, begini, pasti, para, artis, kpop, lain, pada, meniru, eakk];[kalo, benaran, bts, artis, kpop, meniru, eakk];[kalo, benar, bts, artis, kpop, tiru, eakk];negatif
knpa yah pelet group survival mnet tuh kenceng bangetgue udh memantapkan diri buat ga terlalu nyemplung ke kpop lagi eh gr gr liat satu video langsung ambyar;[knpa, yah, pelet, group, survival, mnet, tuh, kenceng, bangetgue, udh, memantapkan, diri, buat, ga, terlalu, nyemplung, ke, kpop, lagi, eh, gr, gr, liat, satu, video, langsung, ambyar];[kenapa, ya, pelet, group, survival, mnet, tuh, kencang, bangetgue, sudah, memantapkan, diri, buat, enggak, terlalu, nyemplung, ke, kpop, lagi, eh, gr, gr, lihat, satu, video, langsung, ambyar];[ya, pelet, group, survival, mnet, tuh, kencang, bangetgue, memantapkan, terlalu, nyemplung, kpop, eh, gr, gr, lihat, video, langsung, ambyar];[ya, pelet, group, survival, mnet, tuh, kencang, bangetgue, mantap, terlalu, nyemplung, kpop, eh, gr, gr, lihat, video, langsung, ambyar];positif
akibat tidak membaca grup matkul berujung online ny disini kuping kiri denger zoom kuping kanan denger lagu kpop;[akibat, tidak, membaca, grup, matkul, berujung, online, ny, disini, kuping, kiri, denger, zoom, kuping, kanan, denger, lagu, kpop];[akibat, tidak, membaca, grup, matkul, berujung, online, nya, disini, kuping, kiri, dengar, zoom, kuping, kanan, dengar, lagu, kpop];[akibat, membaca, grup, matkul, berujung, online, nya, kuping, kiri, dengar, zoom, kuping, kanan, dengar, lagu, kpop];[akibat, baca, grup, matkul, ujung, online, nya, kuping, kiri, dengar, zoom, kuping, kanan, dengar, lagu, kpop];positif
kek setelah beratus tahun aing pake wallpaper kpop lagi;[kek, setelah, beratus, tahun, aing, pake, wallpaper, kpop, lagi];[kayak, setelah, beratus, tahun, aing, pakai, wallpaper, kpop, lagi];[kayak, beratus, aing, pakai, wallpaper, kpop];[kayak, atus, aing, pakai, wallpaper, kpop];positif
gausah kepoin yg lagi trending selain kpop si soalnya ya gitu hha;[gausah, kepoin, yg, lagi, trending, selain, kpop, si, soalnya, ya, gitu, hha];[enggak usah, mengepoi, yang, lagi, trending, selain, kpop, sih, soalnya, ya, begitu, hha];[enggak usah, mengepoi, trending, kpop, sih, ya, hha];[enggak usah, mengepoi, trending, kpop, sih, ya, hha];negatif
pengen kenalin pacar gepeng fiksi kpop buat dream date pengen study date aquarium date movie date timezone date;[pengen, kenalin, pacar, gepeng, fiksi, kpop, buat, dream, date, pengen, study, date, aquarium, date, movie, date, timezone, date];[pengin, mengenalkan, pacar, gepeng, fiksi, kpop, buat, dream, date, pengin, study, date, aquarium, date, movie, date, timezone, date];[pengin, mengenalkan, pacar, gepeng, fiksi, kpop, dream, date, pengin, study, date, aquarium, date, movie, date, timezone, date];[pengin, kenal, pacar, gepeng, fiksi, kpop, dream, date, pengin, study, date, aquarium, date, movie, date, timezone, date];positif
diem la muka kpop gmbr kpop dh tahu bodoh suppo victim mabuk dkt kelab;[diem, la, muka, kpop, gmbr, kpop, dh, tahu, bodoh, suppo, victim, mabuk, dkt, kelab];[diam, lah, muka, kpop, gmbr, kpop, deh, tahu, bodoh, suppo, victim, mabuk, dkt, kelab];[diam, muka, kpop, gmbr, kpop, deh, bodoh, suppo, victim, mabuk, dkt, kelab];[diam, muka, kpop, gmbr, kpop, deh, bodoh, suppo, victim, mabuk, dkt, kelab];negatif
gue legit belom buka akun kpop gue wkwkw terlalu banyak drama;[gue, legit, belom, buka, akun, kpop, gue, wkwkw, terlalu, banyak, drama];[gue, legit, belum, buka, akun, kpop, gue, wkwkw, terlalu, banyak, drama];[gue, legit, buka, akun, kpop, gue, wkwkw, terlalu, drama];[gue, legit, buka, akun, kpop, gue, wkwkw, terlalu, drama];negatif
seengaknya gue ketemu abang gue lah si taka klo tahun ini gagal nonton konser kpop grgr lg msqn;[seengaknya, gue, ketemu, abang, gue, lah, si, taka, klo, tahun, ini, gagal, nonton, konser, kpop, grgr, lg, msqn];[seengaknya, gue, ketemu, abang, gue, lah, sih, taka, kalo, tahun, ini, gagal, menonton, konser, kpop, gara-gara, lagi, msqn];[seengaknya, gue, ketemu, abang, gue, sih, taka, kalo, gagal, menonton, konser, kpop, gara-gara, msqn];[seengaknya, gue, ketemu, abang, gue, sih, taka, kalo, gagal, tonton, konser, kpop, gara-gara, msqn];negatif
setiap hari ada aja gebrakan dari cowo kpop;[setiap, hari, ada, aja, gebrakan, dari, cowo, kpop];[setiap, hari, ada, saja, gebrakan, dari, cowok, kpop];[gebrakan, cowok, kpop];[gebrak, cowok, kpop];positif
baiklah saya akan mulai menjalani kesendirian ini bersama cowo kpopand on my own heppines;[baiklah, saya, akan, mulai, menjalani, kesendirian, ini, bersama, cowo, kpopand, on, my, own, heppines];[baiklah, saya, akan, mulai, menjalani, kesendirian, ini, bersama, cowok, kpopand, on, my, own, heppines];[baiklah, menjalani, kesendirian, cowok, kpopand, on, my, own, heppines];[baik, jalan, sendiri, cowok, kpopand, on, my, own, heppines];positif
jadi sepei itu ak juga baru terjun ke dunia kpop makasi atas informasinya kak;[jadi, sepei, itu, ak, juga, baru, terjun, ke, dunia, kpop, makasi, atas, informasinya, kak];[jadi, sepei, itu, aku, juga, baru, terjun, ke, dunia, kpop, terima kasih, atas, informasinya, kak];[sepei, terjun, dunia, kpop, terima kasih, informasinya, kak];[pei, terjun, dunia, kpop, terima kasih, informasi, kak];positif
top diisi cowo kpop imagine dragons mba laufey;[top, diisi, cowo, kpop, imagine, dragons, mba, laufey];[top, diisi, cowok, kpop, imagine, dragons, mbak, laufey];[top, diisi, cowok, kpop, imagine, dragons, mbak, laufey];[top, isi, cowok, kpop, imagine, dragons, mbak, laufey];netral
km kalo liat rant accku pasti bingung ini orang sbnrnya naksir lelaki kpop yang mana;[km, kalo, liat, rant, accku, pasti, bingung, ini, orang, sbnrnya, naksir, lelaki, kpop, yang, mana];[kamu, kalo, lihat, rant, accku, pasti, bingung, ini, orang, sbnrnya, menaksir, lelaki, kpop, yang, mana];[kalo, lihat, rant, accku, bingung, orang, sbnrnya, menaksir, lelaki, kpop];[kalo, lihat, rant, accku, bingung, orang, sbnrnya, taksir, lelaki, kpop];positif
tp gw pgn nonton konser kpop gtlohhh kek kapanlagii mennn jd mending nonton apa nggaa sbnrnya ga izin jg gpp sih tp ngeri aja ada apa apa kl ga izin;[tp, gw, pgn, nonton, konser, kpop, gtlohhh, kek, kapanlagii, mennn, jd, mending, nonton, apa, nggaa, sbnrnya, ga, izin, jg, gpp, sih, tp, ngeri, aja, ada, apa, apa, kl, ga, izin];[tapi, gue, pengin, menonton, konser, kpop, gtlohhh, kayak, kapanlagii, mennn, jadi, mending, menonton, apa, nggaa, sbnrnya, enggak, izin, juga, enggak apa-apa, sih, tapi, ngeri, saja, ada, apa, apa, kalau, enggak, izin];[gue, pengin, menonton, konser, kpop, gtlohhh, kayak, kapanlagii, mennn, mending, menonton, nggaa, sbnrnya, izin, enggak apa-apa, sih, ngeri, izin];[gue, pengin, tonton, konser, kpop, gtlohhh, kayak, kapanlagii, mennn, mending, tonton, nggaa, sbnrnya, izin, enggak apa, sih, ngeri, izin];positif
pake first acc kachii kalo ga keberatan kachi suka hype kpopava yae yah kakk;[pake, first, acc, kachii, kalo, ga, keberatan, kachi, suka, hype, kpopava, yae, yah, kakk];[pakai, first, acc, kachii, kalo, enggak, keberatan, kachi, suka, hype, kpopava, yae, ya, kak];[pakai, first, acc, kachii, kalo, keberatan, kachi, suka, hype, kpopava, yae, ya, kak];[pakai, first, acc, kachii, kalo, berat, kachi, suka, hype, kpopava, yae, ya, kak];positif
ni dyandra gw liat bikin event kpop kali dalam bulan ini;[ni, dyandra, gw, liat, bikin, event, kpop, kali, dalam, bulan, ini];[ini, dyandra, gue, lihat, bikin, event, kpop, kali, dalam, bulan, ini];[dyandra, gue, lihat, bikin, event, kpop, kali, dalam, bulan];[dyandra, gue, lihat, bikin, event, kpop, kali, dalam, bulan];netral
bangsatt ini patah hati pertama gue di kpop;[bangsatt, ini, patah, hati, pertama, gue, di, kpop];[bangsat, ini, patah, hati, pertama, gue, di, kpop];[bangsat, patah, hati, pertama, gue, kpop];[bangsat, patah, hati, pertama, gue, kpop];negatif
kalo bukan kpop boleh ngga;[kalo, bukan, kpop, boleh, ngga];[kalo, bukan, kpop, boleh, enggak];[kalo, kpop];[kalo, kpop];negatif
mau resign dari kerjaan tapi inget ada bujang kpop yg harus gw nafkahin cuma bisa yuk semangat hehe;[mau, resign, dari, kerjaan, tapi, inget, ada, bujang, kpop, yg, harus, gw, nafkahin, cuma, bisa, yuk, semangat, hehe];[mau, resign, dari, pekerjaan, tapi, ingat, ada, bujang, kpop, yang, harus, gue, nafkahin, cuma, bisa, yuk, semangat, hehe];[resign, pekerjaan, ada, bujang, kpop, gue, nafkahin, cuma, yuk, semangat, hehe];[resign, kerja, ada, bujang, kpop, gue, nafkahin, cuma, yuk, semangat, hehe];positif
dulu ngilangin stres larinya ke kpop sekarang gua kayaknya bukan stress lagi udah gila soalnya udah gabisa move ke apapun fokus lanjutin hidup karena gk ada waktu luang buat sekedar istirahat;[dulu, ngilangin, stres, larinya, ke, kpop, sekarang, gua, kayaknya, bukan, stress, lagi, udah, gila, soalnya, udah, gabisa, move, ke, apapun, fokus, lanjutin, hidup, karena, gk, ada, waktu, luang, buat, sekedar, istirahat];[dulu, menghilangkan, stres, larinya, ke, kpop, sekarang, gue, kayaknya, bukan, stres, lagi, sudah, gila, soalnya, sudah, enggak bisa, move, ke, apapun, fokus, lanjutkan, hidup, karena, enggak, ada, waktu, luang, buat, sekedar, istirahat];[menghilangkan, stres, larinya, kpop, gue, kayaknya, stres, gila, enggak bisa, move, apapun, fokus, lanjutkan, hidup, luang, sekedar, istirahat];[hilang, stres, lari, kpop, gue, kayak, stres, gila, enggak bisa, move, apa, fokus, lanjut, hidup, luang, dar, istirahat];negatif
wrong putra mahkota idola paragen z anak meme kpopwibu indon itu pembimbing dan penasehatnya bajer boom;[wrong, putra, mahkota, idola, paragen, z, anak, meme, kpopwibu, indon, itu, pembimbing, dan, penasehatnya, bajer, boom];[wrong, putra, mahkota, idola, paragen, saja, anak, meme, kpopwibu, indon, itu, pembimbing, dan, penasehatnya, bajer, boom];[wrong, putra, mahkota, idola, paragen, anak, meme, kpopwibu, indon, pembimbing, penasehatnya, bajer, boom];[wrong, putra, mahkota, idola, paragen, anak, meme, kpopwibu, indon, bimbing, nasehat, bajer, boom];negatif
kalau ngomongin kpop emang lagu gfriend doang yg masuk ke selera;[kalau, ngomongin, kpop, emang, lagu, gfriend, doang, yg, masuk, ke, selera];[kalau, mengomongkan, kpop, memang, lagu, gfriend, doang, yang, masuk, ke, selera];[mengomongkan, kpop, lagu, gfriend, doang, masuk, selera];[omong, kpop, lagu, gfriend, doang, masuk, selera];positif
td dengerin lagulagu kpop trus keauto play sampe muterin lagu india hhhshshhshs;[td, dengerin, lagulagu, kpop, trus, keauto, play, sampe, muterin, lagu, india, hhhshshhshs];[tadi, dengarkan, lagulagu, kpop, terus, keauto, play, sampai, muterin, lagu, india, hhhshshhshs];[dengarkan, lagulagu, kpop, keauto, play, muterin, lagu, india, hhhshshhshs];[dengar, lagulagu, kpop, auto, play, muterin, lagu, india, hhhshshhshs];positif
wrong putra mahkota idola paragen z anak meme kpopwibu indon itu pembimbing dan penasehatnya bajer boomer pra stroke rahayu semua;[wrong, putra, mahkota, idola, paragen, z, anak, meme, kpopwibu, indon, itu, pembimbing, dan, penasehatnya, bajer, boomer, pra, stroke, rahayu, semua];[wrong, putra, mahkota, idola, paragen, saja, anak, meme, kpopwibu, indon, itu, pembimbing, dan, penasehatnya, bajer, boomer, pra, stroke, rahayu, semua];[wrong, putra, mahkota, idola, paragen, anak, meme, kpopwibu, indon, pembimbing, penasehatnya, bajer, boomer, pra, stroke, rahayu];[wrong, putra, mahkota, idola, paragen, anak, meme, kpopwibu, indon, bimbing, nasehat, bajer, boomer, pra, stroke, rahayu];negatif
dah sengaja nahan diri biar gak suka kpop lagi apalagi biar gak naksir ateez dari dulu sekarang malah dibikin gila sama fc ateez;[dah, sengaja, nahan, diri, biar, gak, suka, kpop, lagi, apalagi, biar, gak, naksir, ateez, dari, dulu, sekarang, malah, dibikin, gila, sama, fc, ateez];[deh, sengaja, menahan, diri, biar, enggak, suka, kpop, lagi, apalagi, biar, enggak, menaksir, ateez, dari, dulu, sekarang, malah, dibikin, gila, sama, fc, ateez];[deh, sengaja, menahan, biar, suka, kpop, biar, menaksir, ateez, dibikin, gila, fc, ateez];[deh, sengaja, tahan, biar, suka, kpop, biar, taksir, ateez, bikin, gila, fc, ateez];negatif
cowok kpop gepeng ku datang;[cowok, kpop, gepeng, ku, datang];[cowok, kpop, gepeng, ku, datang];[cowok, kpop, gepeng, ku];[cowok, kpop, gepeng, ku];netral
pip bisa dicoba lawan fans kpop grup cewek gak kalah ngeri sama fans kpop grup cowok;[pip, bisa, dicoba, lawan, fans, kpop, grup, cewek, gak, kalah, ngeri, sama, fans, kpop, grup, cowok];[pip, bisa, dicoba, lawan, fan, kpop, grup, cewek, enggak, kalah, ngeri, sama, fan, kpop, grup, cowok];[pip, dicoba, lawan, fan, kpop, grup, cewek, kalah, ngeri, fan, kpop, grup, cowok];[pip, coba, lawan, fan, kpop, grup, cewek, kalah, ngeri, fan, kpop, grup, cowok];negatif
makanya aku mah gapernah nonton reaction soalnya hmmm apalagi bule bule yang react kpop hadah skip;[makanya, aku, mah, gapernah, nonton, reaction, soalnya, hmmm, apalagi, bule, bule, yang, react, kpop, hadah, skip];[makanya, aku, mah, enggak pernah, menonton, reaction, soalnya, hmmm, apalagi, bule, bule, yang, react, kpop, hadah, skip];[aku, mah, enggak pernah, menonton, reaction, hmmm, bule, bule, react, kpop, hadah, skip];[aku, mah, enggak pernah, tonton, reaction, hmmm, bule, bule, react, kpop, hadah, skip];negatif
cowo kpop aktor koreathai kucing;[cowo, kpop, aktor, koreathai, kucing];[cowok, kpop, aktor, koreathai, kucing];[cowok, kpop, aktor, koreathai, kucing];[cowok, kpop, aktor, koreathai, kucing];netral
mama sama kpop;[mama, sama, kpop];[mama, sama, kpop];[mama, kpop];[mama, kpop];netral
dh lama ga jajan pc lakik kpop;[dh, lama, ga, jajan, pc, lakik, kpop];[deh, lama, enggak, jajan, pc, laki, kpop];[deh, jajan, pc, laki, kpop];[deh, jajan, pc, laki, kpop];netral
ini mutualku ada yg strict gasuka kpop gak ya layout kpop ku nganggur soalnya udah ga main erpe lagi mau kupake tapi ermmm;[ini, mutualku, ada, yg, strict, gasuka, kpop, gak, ya, layout, kpop, ku, nganggur, soalnya, udah, ga, main, erpe, lagi, mau, kupake, tapi, ermmm];[ini, mutualku, ada, yang, strict, gasuka, kpop, enggak, ya, layout, kpop, ku, nganggur, soalnya, sudah, enggak, main, erpe, lagi, mau, kupake, tapi, ermmm];[mutualku, strict, gasuka, kpop, ya, layout, kpop, ku, nganggur, main, erpe, kupake];[mutualku, strict, gasuka, kpop, ya, layout, kpop, ku, nganggur, main, erpe, pakai];negatif
wkwkwkkw seventeen kpopakhirnya junhaooo;[wkwkwkkw, seventeen, kpopakhirnya, junhaooo];[wkwkwkkw, seventeen, kpopakhirnya, junhaooo];[seventeen, kpopakhirnya, junhaooo];[seventeen, kpopakhirnya, junhaooo];netral
nangissss kpop bisa manggung disana buanyam banget walau masih di macau tapi thank you so much;[nangissss, kpop, bisa, manggung, disana, buanyam, banget, walau, masih, di, macau, tapi, thank, you, so, much];[nangis, kpop, bisa, manggung, disana, buanyam, banget, walau, masih, di, macau, tapi, thank, you, sok, much];[nangis, kpop, manggung, disana, buanyam, banget, macau, thank, you, sok, much];[nangis, kpop, manggung, sana, buanyam, banget, macau, thank, you, sok, much];positif
tulungggg massseeeh btw g nutup kemungkinan kan adain konser kpop di solo;[tulungggg, massseeeh, btw, g, nutup, kemungkinan, kan, adain, konser, kpop, di, solo];[tolong, mas, btw, enggak, nutup, kemungkinan, kan, mengadakan, konser, kpop, di, solo];[tolong, mas, nutup, mengadakan, konser, kpop, solo];[tolong, mas, nutup, ada, konser, kpop, solo];positif
iyakan bener bgt aku yg ga pernah ngestan kpop jadi ngestan kpop pertama kali itu zb;[iyakan, bener, bgt, aku, yg, ga, pernah, ngestan, kpop, jadi, ngestan, kpop, pertama, kali, itu, zb];[iyakan, benar, banget, aku, yang, enggak, pernah, ngestan, kpop, jadi, ngestan, kpop, pertama, kali, itu, zb];[iyakan, banget, ngestan, kpop, ngestan, kpop, pertama, kali, zb];[iya, banget, ngestan, kpop, ngestan, kpop, pertama, kali, zb];positif
iya aku jg pdhl dah lama stan kpop bahkan ngestan x jg tapi ga sampai kek gini tiap hari uringuringan nungguin konten ckckckk kangen trs;[iya, aku, jg, pdhl, dah, lama, stan, kpop, bahkan, ngestan, x, jg, tapi, ga, sampai, kek, gini, tiap, hari, uringuringan, nungguin, konten, ckckckk, kangen, trs];[iya, aku, juga, padahal, deh, lama, stan, kpop, bahkan, ngestan, kali, juga, tapi, enggak, sampai, kayak, begini, tiap, hari, uringuringan, menunggu, konten, ckckckk, kangen, terus];[iya, deh, stan, kpop, ngestan, kali, kayak, uringuringan, menunggu, konten, ckckckk, kangen];[iya, deh, stan, kpop, ngestan, kali, kayak, uringuringan, tunggu, konten, ckckckk, kangen];positif
krn lingkungan sekitar sedikit bgt yg suka kpop dan waktu itu sibuk les sana sini biar masuk ptn akhirnya makin kesini makin lupa dari yang excited dtg ke bandara nyamperin vote brkali ky orgil biar menang spend money luar biasa buat kol;[krn, lingkungan, sekitar, sedikit, bgt, yg, suka, kpop, dan, waktu, itu, sibuk, les, sana, sini, biar, masuk, ptn, akhirnya, makin, kesini, makin, lupa, dari, yang, excited, dtg, ke, bandara, nyamperin, vote, brkali, ky, orgil, biar, menang, spend, money, luar, biasa, buat, kol];[karena, lingkungan, sekitar, sedikit, banget, yang, suka, kpop, dan, waktu, itu, sibuk, les, sana, sini, biar, masuk, ptn, akhirnya, makin, kesini, makin, lupa, dari, yang, excited, datang, ke, bandara, nyamperin, vote, brkali, kaya, orgil, biar, menang, spend, money, luar, biasa, buat, kol];[lingkungan, banget, suka, kpop, sibuk, les, biar, masuk, ptn, kesini, lupa, excited, bandara, nyamperin, vote, brkali, kaya, orgil, biar, menang, spend, money, kol];[lingkung, banget, suka, kpop, sibuk, les, biar, masuk, ptn, kesini, lupa, excited, bandara, nyamperin, vote, brkali, kaya, orgil, biar, menang, spend, money, kol];positif
hari hari nangisin cowo kpop;[hari, hari, nangisin, cowo, kpop];[hari, hari, nangisin, cowok, kpop];[nangisin, cowok, kpop];[nangisin, cowok, kpop];negatif
kpop event in medan;[kpop, event, in, medan];[kpop, event, ini, medan];[kpop, event, medan];[kpop, event, medan];netral
jadi kpop idolkl pun muka ga mendukung bisa oplas tp tp yhaa tp seru si pas ngayal;[jadi, kpop, idolkl, pun, muka, ga, mendukung, bisa, oplas, tp, tp, yhaa, tp, seru, si, pas, ngayal];[jadi, kpop, idolkl, pun, muka, enggak, mendukung, bisa, operasi plastik, tapi, tapi, yhaa, tapi, seru, sih, pas, mengkhayal];[kpop, idolkl, muka, mendukung, operasi plastik, yhaa, seru, sih, pas, mengkhayal];[kpop, idolkl, muka, dukung, operasi plastik, yhaa, seru, sih, pas, khayal];negatif
pengen banget hijrah gak mau lagi kpop an aku unfollow akun akun kpop twitter instagram aku unfollow uangnya lebih baik ditabung untuk berqurban untuk pergi umroh;[pengen, banget, hijrah, gak, mau, lagi, kpop, an, aku, unfollow, akun, akun, kpop, twitter, instagram, aku, unfollow, uangnya, lebih, baik, ditabung, untuk, berqurban, untuk, pergi, umroh];[pengin, banget, hijrah, enggak, mau, lagi, kpop, an, aku, unfollow, akun, akun, kpop, twitter, instagram, aku, unfollow, uangnya, lebih, baik, ditabung, untuk, berqurban, untuk, pergi, umroh];[pengin, banget, hijrah, kpop, an, unfollow, akun, akun, kpop, twitter, instagram, unfollow, uangnya, ditabung, berqurban, pergi, umroh];[pengin, banget, hijrah, kpop, an, unfollow, akun, akun, kpop, twitter, instagram, unfollow, uang, tabung, berqurban, pergi, umroh];negatif
semua fans kpop tuh bakal begini ke group favoritnya jadi intinya gausah ada kpop aja wkwkwwk;[semua, fans, kpop, tuh, bakal, begini, ke, group, favoritnya, jadi, intinya, gausah, ada, kpop, aja, wkwkwwk];[semua, fan, kpop, tuh, bakal, begini, ke, group, favoritnya, jadi, intinya, enggak usah, ada, kpop, saja, wkwkwwk];[fan, kpop, tuh, group, favoritnya, intinya, enggak usah, kpop, wkwkwwk];[fan, kpop, tuh, group, favorit, inti, enggak usah, kpop, wkwkwwk];negatif
udh boleh masuk kah kpop group;[udh, boleh, masuk, kah, kpop, group];[sudah, boleh, masuk, kah, kpop, group];[masuk, kah, kpop, group];[masuk, kah, kpop, group];netral
wkwkw asli dah kirain udh sembuh eh kumat juga jajan printilan kpop semangat warnya cifel;[wkwkw, asli, dah, kirain, udh, sembuh, eh, kumat, juga, jajan, printilan, kpop, semangat, warnya, cifel];[wkwkw, asli, deh, mengira, sudah, sembuh, eh, kumat, juga, jajan, printilan, kpop, semangat, warnya, cifel];[asli, deh, sembuh, eh, kumat, jajan, printilan, kpop, semangat, warnya, cifel];[asli, deh, sembuh, eh, kumat, jajan, printilan, kpop, semangat, warnya, cifel];positif
